{
  "contract_version": 1,
  "created_at": "2026-01-30T07:00:00+00:00",
  "final_status": "passed",
  "intent": "dry_run",
  "manifest_digest_sha256": "eefed7acd6458994d7f6456fd4f95a091bde64b2d07d7814c8856c3112d60ac4",
  "request_content_generation_id": "44704900b4f0f88e34bc0324d74d72c84e1a2086be60b1b97e31f014efb23261",
  "request_manifest_digest_sha256": "68bf1158c4ee0d20d872763838776ed4d9f422d17e6cf90f9d69cd137c45abd1",
  "run_id": "00000000-0000-4000-8000-000000000001",
  "runner_identity": {
    "code_fingerprint": "0000000000000000000000000000000000000000000000000000000000000000",
    "environment_profile": "macos-arm64",
    "lock_digest_sha256": "0000000000000000000000000000000000000000000000000000000000000000"
  },
  "schema_version": "1.0.0",
  "stage_records": [
    {
      "failure_reason": null,
      "output_bindings": [
        {
          "data_checksum_sha256": "0000000000000000000000000000000000000000000000000000000000000000",
          "failure_reason": null,
          "generation_id": "44704900b4f0f88e34bc0324d74d72c84e1a2086be60b1b97e31f014efb23261",
          "manifest_digest_sha256": "68bf1158c4ee0d20d872763838776ed4d9f422d17e6cf90f9d69cd137c45abd1",
          "output_family": "research_run_request",
          "physical_path": "research_runs/requests/request=44704900b4f0f88e34bc0324d74d72c84e1a2086be60b1b97e31f014efb23261/run=00000000-0000-4000-8000-000000000001/manifest.json",
          "quality_decision_checksum_sha256": "0000000000000000000000000000000000000000000000000000000000000000"
        }
      ],
      "stage": "resolve_request",
      "status": "passed"
    }
  ],
  "state_content_generation_id": "394f8c7261aae5d9e65b6a4b266afaf05a586b291ba140cb8575430187259391"
}
